book_title,publication_date,author,genres,ratings,num_pages,rank,language,curr_readers,want_read
"Tongues, Vol. 1","First published March 11, 2025",Anders Nilsen,"Graphic Novels, Comics, Fantasy, Fiction, Mythology, Graphic Novels Comics, Adult",4.25 avg rating — 730 ratings,"368 pages, Hardcover",265,,113 people are currently reading,4810 people want to read
"Green-Eyed Monster (Court of Chains, #3)","First published June 17, 2025",Rawnie Sabor,"Lesbian, Fantasy, Romance, Enemies To Lovers, Paranormal, LGBT, Queer","4.60 avg rating — 1,236 ratings","573 pages, Kindle Edition",265,,205 people are currently reading,1230 people want to read
Flashlight,"First published June 3, 2025",Susan Choi,"Fiction, Historical Fiction, Literary Fiction, Mystery, Audiobook, Japan, Book Club","3.93 avg rating — 17,214 ratings","464 pages, Hardcover",265,,5332 people are currently reading,84835 people want to read
The Governess and the Rogue,"First published August 5, 2025",Mimi Matthews,"Romance, Historical Romance, Historical Fiction, Historical, Victorian, Fiction, Audiobook","4.20 avg rating — 1,320 ratings","272 pages, Paperback",265,,94 people are currently reading,861 people want to read
Speaking in Tongues,"First published May 6, 2025",J.M. Coetzee,"Nonfiction, Language, Linguistics, Literature, Essays, Audiobook, Writing",3.71 avg rating — 227 ratings,"144 pages, Hardcover",276,,65 people are currently reading,3078 people want to read
The Queens of Crime,"First published February 11, 2025",Marie Benedict,"Historical Fiction, Mystery, Fiction, Audiobook, Historical, Book Club, Mystery Thriller","3.81 avg rating — 24,265 ratings","310 pages, Hardcover",276,English,4401 people are currently reading,87253 people want to read
"38 Londres Street: On Impunity, Pinochet in England and a Nazi in Patagonia","First published January 1, 2025",Philippe Sands,"History, Nonfiction, Politics, Law, Biography, World War II, Audiobook","4.20 avg rating — 1,721 ratings","480 pages, Hardcover",276,,577 people are currently reading,6056 people want to read
"The Adventure of the Demonic Ox (Penric and Desdemona, #14)","First published July 10, 2025",Lois McMaster Bujold,"Fantasy, Novella, Audiobook, Fiction, Adventure, Science Fiction Fantasy, Magic","4.37 avg rating — 2,289 ratings","133 pages, ebook",276,,209 people are currently reading,525 people want to read
"Just a Bit Guarded (Straight Guys, #15)","First published March 28, 2025",Alessandra Hazard,"M M Romance, Romance, Contemporary, LGBT, Gay For You, Forced Proximity, Enemies To Lovers","3.73 avg rating — 3,458 ratings","257 pages, Kindle Edition",276,,446 people are currently reading,2249 people want to read
"Our Dollar, Your Problem: An Insider's View of Seven Turbulent Decades of Global Finance, and the Road Ahead","First published May 6, 2025",Kenneth Rogoff,"Economics, Finance, Nonfiction, History, Business, Politics, Money",4.17 avg rating — 860 ratings,"360 pages, Hardcover",276,,630 people are currently reading,4048 people want to read
Witch Hazel: Variety Hour,"First published August 20, 2025",Colton Fox,"Comics, Fantasy, Graphic Novels Comics",3.86 avg rating — 36 ratings,"48 pages, Paperback",276,English,,16 people want to read
And the River Drags Her Down,"First published October 7, 2025",Jihyun Yun,"Horror, Fantasy, Young Adult, Mystery, Thriller, Paranormal, Fiction","4.12 avg rating — 1,419 ratings","390 pages, Kindle Edition",276,English,213 people are currently reading,14663 people want to read
Nobody's Girl,"First published October 21, 2025",Virginia Roberts Giuffre,"Nonfiction, Memoir, Audiobook, True Crime, Biography, Biography Memoir, Crime","4.54 avg rating — 76,360 ratings","384 pages, Kindle Edition",276,,26223 people are currently reading,109541 people want to read
Tantrum,"First published August 5, 2025",Rachel Eve Moulton,"Horror, Fiction, Audiobook, Adult, Thriller, Contemporary, Novella","3.53 avg rating — 4,333 ratings","192 pages, Hardcover",276,English,124 people are currently reading,27249 people want to read
"The Black Wolf (Chief Inspector Armand Gamache, #20)","First published October 28, 2025",Louise Penny,"Mystery, Fiction, Audiobook, Thriller, Mystery Thriller, Canada, Crime","4.16 avg rating — 34,783 ratings","375 pages, Hardcover",276,,6216 people are currently reading,23498 people want to read
"Hekate - The Witch (Goddesses of the Underworld, #1)","First published September 16, 2025",Nikita Gill,"Fantasy, Mythology, Poetry, Retellings, Greek Mythology, Fiction, Young Adult","4.12 avg rating — 9,625 ratings","376 pages, Kindle Edition",276,,1206 people are currently reading,67974 people want to read
The True True Story of Raja the Gullible,"First published September 2, 2025",Rabih Alameddine,"Fiction, LGBT, Literary Fiction, Audiobook, Historical Fiction, Queer, Book Club","4.07 avg rating — 8,252 ratings","336 pages, Hardcover",276,English,1534 people are currently reading,28709 people want to read
Play Nice,"First published September 9, 2025",Rachel Harrison,"Horror, Audiobook, Fiction, Paranormal, Thriller, Mystery, Gothic","3.89 avg rating — 52,282 ratings","336 pages, Hardcover",276,,2142 people are currently reading,114313 people want to read
"Savage (Park Avenue Kings, #1)","First published January 24, 2025",Brooke Blaine,"M M Romance, Romance, Contemporary, Crime, Forced Proximity, Dark Romance, LGBT","4.09 avg rating — 2,757 ratings","322 pages, Kindle Edition",290,English,652 people are currently reading,1878 people want to read
"The Night Eaters, Vol. 3: Their Kingdom Come","Published April 15, 2025",Marjorie M. Liu,"Graphic Novels, Horror, Comics, Fantasy, Fiction, Graphic Novels Comics, Supernatural",4.25 avg rating — 636 ratings,"320 pages, Paperback",290,,36 people are currently reading,778 people want to read
"A Mouthful of Dust (The Singing Hills Cycle, #6)","First published October 7, 2025",Nghi Vo,"Fantasy, Novella, Audiobook, Fiction, Horror, Queer, LGBT","4.18 avg rating — 2,843 ratings","112 pages, Hardcover",290,English,58 people are currently reading,3321 people want to read
"Spark the Flames (Secret of the Syphon, #1)","First published March 21, 2025",Ivy Asher,"Fantasy, Romantasy, Dragons, Romance, Enemies To Lovers, Fantasy Romance, Magic","4.42 avg rating — 7,082 ratings",,290,,1640 people are currently reading,20355 people want to read
The Unmapping,"First published June 3, 2025",Denise S. Robbins,"Science Fiction, Fiction, Dystopia, Fantasy, Audiobook, Adult, Speculative Fiction",3.17 avg rating — 852 ratings,"408 pages, Paperback",290,English,114 people are currently reading,12185 people want to read
Kill Your Boss,"First published November 4, 2025",Jack Heath,"Audiobook, Mystery, Fiction, Crime, Australia, Thriller, Suspense","3.66 avg rating — 2,083 ratings","349 pages, Kindle Edition",290,English,112 people are currently reading,618 people want to read
"Silver and Lead (October Daye, #19)","First published September 30, 2025",Seanan McGuire,"Urban Fantasy, Fantasy, Fae, Magic, Fiction, Paranormal, Adult","4.33 avg rating — 2,031 ratings","389 pages, Hardcover",290,,531 people are currently reading,1167 people want to read
No More Tears: The Dark Secrets of Johnson & Johnson,"First published April 8, 2025",Gardiner Harris,"Nonfiction, Audiobook, History, Business, Science, True Crime, Politics","4.18 avg rating — 17,682 ratings","464 pages, Hardcover",290,English,4514 people are currently reading,73801 people want to read
Our Last Wild Days,"First published April 24, 2025",Anna Bailey,"Thriller, Mystery, Fiction, Mystery Thriller, Suspense, Audiobook, Gothic","3.73 avg rating — 1,925 ratings","320 pages, Hardcover",298,,160 people are currently reading,19969 people want to read
"Calling Chaos (Demon Bound, #3)","First published March 28, 2025",Grae Bryan,"M M Romance, Paranormal, Romance, Fantasy, Demons, Paranormal Romance, Magic","4.12 avg rating — 2,681 ratings","248 pages, Kindle Edition",298,English,308 people are currently reading,711 people want to read
Air-Borne: The Hidden History of the Life We Breathe,"First published February 25, 2025",Carl Zimmer,"Science, Nonfiction, History, Biology, Health, Audiobook, Medicine",4.08 avg rating — 859 ratings,"496 pages, Hardcover",298,,273 people are currently reading,7084 people want to read
Girl Dinner,"First published October 21, 2025",Olivie Blake,"Horror, Fiction, Dark Academia, Thriller, Audiobook, Adult, Contemporary","3.40 avg rating — 14,041 ratings","368 pages, Kindle Edition",298,,1807 people are currently reading,77855 people want to read
Electric Cowboy,"First published October 15, 2025",Ansel Kite,"Comics, Graphic Novels, Manga, Science Fiction",3.66 avg rating — 47 ratings,"48 pages, Paperback",298,,,37 people want to read
Apple in China: The Capture of the World's Greatest Company,"First published January 1, 2025",Patrick McGee,"Business, Nonfiction, China, Technology, Economics, Politics, History","4.49 avg rating — 7,833 ratings","448 pages, Hardcover",298,,2801 people are currently reading,17381 people want to read
Grace & Henry's Holiday Movie Marathon,"First published October 14, 2025",Matthew Norman,"Christmas, Romance, Holiday, Audiobook, Fiction, Contemporary, Grief","4.27 avg rating — 26,991 ratings","337 pages, Paperback",298,,843 people are currently reading,47630 people want to read
The Catch,"First published June 3, 2025",Yrsa Daley-Ward,"Fiction, Literary Fiction, Audiobook, Mystery, Family, Mystery Thriller, Novels","3.25 avg rating — 2,010 ratings","352 pages, Hardcover",298,,813 people are currently reading,10708 people want to read
"Oathbound (The Legendborn Cycle, #3)","First published March 4, 2025",Tracy Deonn,"Fantasy, Young Adult, Romance, Fiction, Audiobook, Young Adult Fantasy, Urban Fantasy","4.23 avg rating — 29,287 ratings","656 pages, Hardcover",306,English,3396 people are currently reading,81547 people want to read
The Starving Saints,"First published May 20, 2025",Caitlin Starling,"Horror, Fantasy, Historical Fiction, Fiction, Queer, LGBT, Historical","3.61 avg rating — 16,595 ratings","352 pages, Hardcover",306,English,4296 people are currently reading,85926 people want to read
10 Ways to Accidentally Fall in Love,"First published February 20, 2025",Emmy Sanders,"M M Romance, Friends To Lovers, Romance, Contemporary, LGBT, Humor, Audiobook","4.17 avg rating — 9,329 ratings","327 pages, Kindle Edition",306,,1047 people are currently reading,4770 people want to read
Pronoun Trouble: The Story of Us in Seven Little Words,"First published April 1, 2025",John McWhorter,"Nonfiction, Language, History, Linguistics, Audiobook, Politics, Writing",3.82 avg rating — 845 ratings,"240 pages, Hardcover",306,English,234 people are currently reading,1747 people want to read
Minor Black Figures,"First published October 7, 2025",Brandon Taylor,"Fiction, Literary Fiction, LGBT, Contemporary, Art, Queer, Gay","3.90 avg rating — 1,385 ratings","320 pages, Kindle Edition",306,English,345 people are currently reading,13351 people want to read
A Guardian and a Thief,"First published October 14, 2025",Megha Majumdar,"Fiction, India, Literary Fiction, Audiobook, Dystopia, Book Club, Science Fiction","3.80 avg rating — 22,873 ratings","224 pages, Hardcover",306,,3435 people are currently reading,95502 people want to read
Through an Open Window,"First published August 19, 2025",Pamela Terry,"Fiction, Fantasy, Magical Realism, Chick Lit, Audiobook, Contemporary, Womens Fiction",4.13 avg rating — 271 ratings,"352 pages, Paperback",306,English,52 people are currently reading,5385 people want to read
"The Raven Scholar (Eternal Path Trilogy, #1)","First published April 15, 2025",Antonia Hodgson,"Fantasy, Mystery, Fiction, Dark Academia, Adult, Audiobook, High Fantasy","4.42 avg rating — 41,077 ratings","643 pages, Paperback",306,English,6604 people are currently reading,192354 people want to read
See How They Fall,"First published April 29, 2025",Rachel Paris,"Mystery, Thriller, Audiobook, Fiction, Mystery Thriller, Suspense, Book Club","4.04 avg rating — 3,275 ratings","336 pages, Paperback",306,English,521 people are currently reading,23900 people want to read
The Magician of Tiger Castle,"First published August 5, 2025",Louis Sachar,"Fantasy, Fiction, Historical Fiction, Adult, Audiobook, Cozy, Romance","3.54 avg rating — 7,771 ratings","306 pages, Hardcover",306,English,768 people are currently reading,43902 people want to read
Snotgirl Volume 4: Make It Make Sense!,"First published July 8, 2025",Bryan Lee O'Malley,"Graphic Novels, Comics, Fiction, Graphic Novels Comics, Queer, Mystery, Adult",4.04 avg rating — 403 ratings,"144 pages, Paperback",306,,17 people are currently reading,359 people want to read
Will There Ever Be Another You,"First published September 23, 2025",Patricia Lockwood,"Fiction, Contemporary, Literary Fiction, Audiobook, Book Club, Mental Health, Literature","3.01 avg rating — 2,328 ratings","248 pages, Hardcover",306,English,648 people are currently reading,17647 people want to read
The Family Recipe,"First published April 1, 2025",Carolyn Huynh,"Fiction, Contemporary, Family, Audiobook, Food, Family Drama, Adult Fiction","3.57 avg rating — 2,709 ratings","317 pages, Kindle Edition",318,,175 people are currently reading,23967 people want to read
The Sideways Life of Denny Voss,"First published April 8, 2025",Holly Kennedy,"Fiction, Mystery, Book Club, Audiobook, Contemporary, Coming Of Age, Disability","4.58 avg rating — 12,812 ratings","330 pages, Kindle Edition",318,English,3375 people are currently reading,18673 people want to read
Textbook Defense (Hockey Ever After #5),"First published February 4, 2025",Ashlyn Kane,"Hockey, Sports, Romance, M M Romance, Sports Romance, Contemporary, LGBT","3.84 avg rating — 1,250 ratings","304 pages, Kindle Edition",318,English,291 people are currently reading,1196 people want to read
Dark Renaissance: The Dangerous Times and Fatal Genius of Shakespeare's Greatest Rival,"First published September 9, 2025",Stephen Greenblatt,"History, Nonfiction, Biography, Shakespeare, Audiobook, Biography Memoir, British Literature","3.99 avg rating — 1,372 ratings","334 pages, Hardcover",318,,568 people are currently reading,13739 people want to read
Your Friend and Mine,"First published July 1, 2025",Jessica Dettmann,"Audiobook, Fiction, Humor, Contemporary, Friendship, Book Club, London","3.70 avg rating — 1,486 ratings","324 pages, Kindle Edition",318,,132 people are currently reading,1952 people want to read
"One Day, Everyone Will Have Always Been Against This","First published February 25, 2025",Omar El Akkad,"Nonfiction, Politics, History, Audiobook, Memoir, Social Justice, War","4.59 avg rating — 52,421 ratings","208 pages, Hardcover",318,English,8397 people are currently reading,207585 people want to read
"Isabella Nagg and the Pot of Basil (Household Gramarye, #1)","First published May 13, 2025",Oliver Darkshire,"Fantasy, Fiction, Cozy, Cozy Fantasy, Humor, Audiobook, Magic","3.62 avg rating — 2,755 ratings","256 pages, Hardcover",324,English,393 people are currently reading,19152 people want to read
Close Your Eyes and Count to 10,"First published February 25, 2025",Lisa Unger,"Thriller, Mystery, Audiobook, Mystery Thriller, Fiction, Suspense, Adult","3.17 avg rating — 19,966 ratings","380 pages, Hardcover",324,English,1916 people are currently reading,88599 people want to read
"Lore Olympus: Volume Eight (Lore Olympus, #8)","First published May 6, 2025",Rachel Smythe,"Graphic Novels, Fantasy, Romance, Mythology, Comics, Retellings, Fiction","4.56 avg rating — 11,601 ratings","416 pages, Paperback",324,English,174 people are currently reading,7492 people want to read
What Is Free Speech?: The History of a Dangerous Idea,"First published March 27, 2025",Fara Dabhoiwala,"History, Politics, Nonfiction, Philosophy, Audiobook, Sociology",3.81 avg rating — 96 ratings,"469 pages, Kindle Edition",324,English,49 people are currently reading,1169 people want to read
Audition for the Fox,"First published September 16, 2025",Martin Cahill,"Fantasy, Fiction, Novella, Audiobook, Mythology, Adult, Young Adult","3.82 avg rating — 2,779 ratings","192 pages, Paperback",328,English,185 people are currently reading,19050 people want to read
"Story of My Life (Story Lake, #1)","First published March 11, 2025",Lucy Score,"Romance, Contemporary, Contemporary Romance, Fiction, Small Town Romance, Audiobook, Rom Com","4.17 avg rating — 120,926 ratings","512 pages, Paperback",328,,29787 people are currently reading,113286 people want to read
The Bachelorette Party,"First published June 10, 2025",Camilla Sten,"Thriller, Mystery, Mystery Thriller, Fiction, Audiobook, Suspense, Adult","3.26 avg rating — 6,894 ratings","304 pages, Hardcover",328,English,340 people are currently reading,74039 people want to read
A Resistance of Witches,"First published July 15, 2025",Morgan Ryan,"Fantasy, Historical Fiction, Fiction, Witches, Audiobook, Historical, Magic","4.09 avg rating — 16,103 ratings","416 pages, Hardcover",328,English,1004 people are currently reading,92841 people want to read
"Remember When: Clarissa's Story (Ravenswood, #4)","First published January 7, 2025",Mary Balogh,"Romance, Historical Romance, Historical, Historical Fiction, Fiction, Regency, Audiobook","really liked it
4.00 avg rating — 2,601 ratings","368 pages, Hardcover",328,,410 people are currently reading,9241 people want to read
Blob: A Love Story,"First published January 28, 2025",Maggie Su,"Fiction, Fantasy, Romance, Audiobook, Magical Realism, Contemporary, Literary Fiction","3.28 avg rating — 13,241 ratings","256 pages, Hardcover",328,English,565 people are currently reading,37085 people want to read
FCBD 2025: Conan the Barbarian: Scourge of the Serpent,"First published May 7, 2025",Jim Zub,"Comics, Fantasy, Comic Book, Sword and Sorcery, Fiction, Graphic Novels",3.96 avg rating — 138 ratings,"30 pages, Kindle Edition",334,,22 people are currently reading,29 people want to read
"Picks and Shovels (Martin Hench, #3)","First published February 18, 2025",Cory Doctorow,"Fiction, Science Fiction, Mystery, Thriller, Audiobook, Technology, Historical Fiction","4.11 avg rating — 1,486 ratings","400 pages, Hardcover",334,English,161 people are currently reading,1384 people want to read
Equality: What It Means and Why It Matters,"First published January 21, 2025",Thomas Piketty,"Philosophy, Politics, Nonfiction, Economics, History, Sociology, Society","3.88 avg rating — 1,295 ratings","128 pages, Hardcover",334,English,201 people are currently reading,9423 people want to read
The Payback,"First published July 15, 2025",Kashana Cauley,"Fiction, Contemporary, Audiobook, Thriller, Humor, Literary Fiction, Crime","3.39 avg rating — 1,480 ratings","256 pages, Hardcover",334,English,155 people are currently reading,18598 people want to read
The Rest of Our Lives,"First published March 25, 2025",Benjamin Markovits,"Fiction, Literary Fiction, Audiobook, Contemporary, Book Club, Family, Road Trip","3.30 avg rating — 15,076 ratings","256 pages, Paperback",334,English,2370 people are currently reading,37482 people want to read
A Song for You & I,"First published March 4, 2025",K. O'Neill,"Graphic Novels, Fantasy, Middle Grade, LGBT, Queer, Comics, Young Adult","4.21 avg rating — 3,187 ratings","240 pages, Paperback",339,,60 people are currently reading,6927 people want to read
"The Summer Guests (The Martini Club, #2)","First published March 18, 2025",Tess Gerritsen,"Mystery, Thriller, Fiction, Mystery Thriller, Audiobook, Suspense, Crime","4.30 avg rating — 43,576 ratings","363 pages, Kindle Edition",339,English,8719 people are currently reading,22271 people want to read
"When Everyone Knows That Everyone Knows...: Common Knowledge and the Mysteries of Money, Power, and Everyday Life","First published September 23, 2025",Steven Pinker,"Nonfiction, Psychology, Science, Audiobook, Philosophy, Sociology, History","3.56 avg rating — 1,592 ratings","384 pages, Hardcover",339,,1175 people are currently reading,11694 people want to read
Little Movements,"First published September 9, 2025",Lauren Morrow,"Fiction, Literary Fiction, Contemporary, Audiobook, Dark Academia, Race, Politics",3.73 avg rating — 661 ratings,"256 pages, Hardcover",339,English,76 people are currently reading,10974 people want to read
"Installment Immortality (InCryptid, #14)","First published March 11, 2025",Seanan McGuire,"Fantasy, Urban Fantasy, Paranormal, Ghosts, Fiction, Adult, Horror","4.21 avg rating — 1,098 ratings","432 pages, Paperback",339,English,380 people are currently reading,666 people want to read
"Good Spirits (Ghosted, #1)","First published October 21, 2025",B.K. Borison,"Romance, Christmas, Holiday, Fantasy, Audiobook, Paranormal, Fiction","3.98 avg rating — 134,595 ratings","384 pages, Kindle Edition",339,,7330 people are currently reading,140174 people want to read
Kirby's Lessons for Falling [in Love],"First published March 4, 2025",Laura Gao,"Graphic Novels, Romance, Young Adult, LGBT, Queer, Contemporary, Comics",3.47 avg rating — 687 ratings,"304 pages, Paperback",345,English,25 people are currently reading,6430 people want to read
The Conditions of Will,"First published April 1, 2025",Jessa Hastings,"Romance, Fiction, Contemporary, Book Club, Contemporary Romance, Audiobook, Fantasy","4.28 avg rating — 92,701 ratings","464 pages, Paperback",345,English,8750 people are currently reading,117587 people want to read
Snake-Eater,"First published November 11, 2025",T. Kingfisher,"Fantasy, Horror, Fiction, Urban Fantasy, Mystery, Paranormal, Adult","4.26 avg rating — 14,611 ratings","208 pages, Hardcover",345,English,3571 people are currently reading,34670 people want to read
"A Conventional Boy (Laundry Files, #13; New Management, #4)","First published January 7, 2025",Charles Stross,"Fantasy, Horror, Science Fiction, Urban Fantasy, Fiction, Audiobook, Humor","4.16 avg rating — 1,278 ratings","384 pages, Hardcover",345,English,243 people are currently reading,642 people want to read
Covenant (The Firm #1),"First published May 23, 2025",Cora Rose,"M M Romance, Enemies To Lovers, Romance, Forced Proximity, Second Chance, Contemporary, Friends To Lovers","4.22 avg rating — 5,177 ratings","356 pages, Kindle Edition",345,English,847 people are currently reading,3027 people want to read
Between Two Rivers: Ancient Mesopotamia and the Birth of History,"First published February 20, 2025",Moudhy Al-Rashid,"History, Nonfiction, Ancient History, Middle East, Audiobook, Historical, Ancient","3.91 avg rating — 1,287 ratings","336 pages, Hardcover",345,,438 people are currently reading,12548 people want to read
"Rage (Kate Burkholder, #17)","First published July 8, 2025",Linda Castillo,"Mystery, Thriller, Fiction, Audiobook, Suspense, Amish, Mystery Thriller","4.21 avg rating — 10,126 ratings","304 pages, Hardcover",345,English,,12142 people want to read
The Seven O'Clock Club,"First published April 15, 2025",Amelia Ireland,"Fiction, Magical Realism, Audiobook, Contemporary, Romance, Fantasy, Book Club","3.80 avg rating — 8,692 ratings","368 pages, Hardcover",352,English,763 people are currently reading,46162 people want to read
"Wings of Starlight (Wings of Pixie Hollow, #1)","First published February 4, 2025",Allison Saft,"Fantasy, Romance, Young Adult, Romantasy, Retellings, Fae, Fiction","4.16 avg rating — 42,123 ratings","400 pages, Hardcover",352,,7599 people are currently reading,111140 people want to read
"Nobody’s Fool (Detective Sami Kierce, #2)","First published March 25, 2025",Harlan Coben,"Mystery, Thriller, Fiction, Mystery Thriller, Audiobook, Crime, Suspense","4.20 avg rating — 41,155 ratings","341 pages, Hardcover",352,,5407 people are currently reading,65946 people want to read
"Breath of the Dragon (Breathmarked, #1)","First published January 7, 2025",Shannon Lee,"Fantasy, Young Adult, Dragons, Young Adult Fantasy, Fiction, Audiobook, High Fantasy","3.94 avg rating — 3,700 ratings","341 pages, Hardcover",352,English,369 people are currently reading,42371 people want to read
Propaganda Girls: The Secret War of the Women in the OSS,"First published March 4, 2025",Lisa Rogak,"Nonfiction, History, Audiobook, World War II, Feminism, Biography, War","3.80 avg rating — 4,622 ratings","225 pages, Hardcover",352,,662 people are currently reading,40336 people want to read
12 Ways to Kill Your Family at Christmas,"First published October 9, 2025",Natasha Bache,"Christmas, Mystery, Holiday, Fiction, Thriller, Audiobook, Book Club","3.77 avg rating — 4,223 ratings","354 pages, Kindle Edition",352,English,547 people are currently reading,4916 people want to read
Breakneck: China's Quest to Engineer the Future,"First published August 26, 2025",Dan Wang,"China, Nonfiction, Politics, Economics, History, Business, Technology","4.14 avg rating — 7,601 ratings","288 pages, Hardcover",352,,2546 people are currently reading,21288 people want to read
Hidden Nature,"First published May 27, 2025",Nora Roberts,"Romance, Mystery, Romantic Suspense, Thriller, Fiction, Audiobook, Suspense","4.12 avg rating — 38,729 ratings","687 pages, Hardcover",352,English,5655 people are currently reading,47181 people want to read
The Seasons #3,"First published March 26, 2025",Rick Remender,Comics,4.12 avg rating — 64 ratings,"24 pages, Kindle Edition",360,English,3 people are currently reading,12 people want to read
The Ghostwriter,"First published June 3, 2025",Julie Clark,"Thriller, Mystery, Mystery Thriller, Fiction, Book Club, Horror, Suspense","4.05 avg rating — 77,089 ratings","328 pages, Hardcover",360,English,,199254 people want to read
