book_title,publication_date,author,genres,ratings,num_pages,rank,language,curr_readers,want_read
Vantage Point,"First published January 14, 2025",Sara Sligar,"Fiction, Thriller, Mystery, Mystery Thriller, Audiobook, Horror, Gothic","3.54 avg rating — 3,723 ratings","400 pages, Hardcover",180,English,332 people are currently reading,18768 people want to read
"Finlay Donovan Digs Her Own Grave (Finlay Donovan, #5)","First published March 4, 2025",Elle Cosimano,"Mystery, Audiobook, Fiction, Mystery Thriller, Cozy Mystery, Humor, Romance","4.06 avg rating — 41,404 ratings","309 pages, Hardcover",180,,1302 people are currently reading,40713 people want to read
Our Infinite Fates,"First published February 27, 2025",Laura Steven,"Fantasy, Romance, Young Adult, Romantasy, Fiction, Audiobook, Fantasy Romance","3.65 avg rating — 65,760 ratings","352 pages, Hardcover",180,English,4682 people are currently reading,180421 people want to read
The Stolen Queen,"First published January 7, 2025",Fiona Davis,"Historical Fiction, Fiction, Mystery, Audiobook, Historical, Book Club, Egypt","3.90 avg rating — 60,771 ratings","352 pages, Hardcover",180,English,4485 people are currently reading,151927 people want to read
"Wild Card (Rose Hill, #4)","First published September 9, 2025",Elsie Silver,"Romance, Small Town Romance, Contemporary Romance, Forced Proximity, Contemporary, Audiobook, Slow Burn","4.10 avg rating — 169,808 ratings","464 pages, Paperback",180,,15976 people are currently reading,162826 people want to read
Minor Arcana Vol. 1,"First published March 25, 2025",Jeff Lemire,"Comics, Graphic Novels, Fantasy, Graphic Novels Comics, Mystery, Horror, Fiction",3.89 avg rating — 626 ratings,"144 pages, Paperback",180,,12 people are currently reading,372 people want to read
My Name Is Emilia del Valle,"First published May 6, 2025",Isabel Allende,"Historical Fiction, Fiction, Historical, Audiobook, Magical Realism, Fantasy, Romance","3.82 avg rating — 27,890 ratings","287 pages, Hardcover",186,English,4155 people are currently reading,60240 people want to read
The Seasons #1,"First published January 29, 2025",Rick Remender,"Comics, Comic Book, Fantasy, Graphic Novels",4.13 avg rating — 127 ratings,"46 pages, Kindle Edition",186,English,8 people are currently reading,79 people want to read
Tell Me What You Did,"First published January 28, 2025",Carter Wilson,"Thriller, Mystery, Mystery Thriller, Audiobook, Fiction, Suspense, Book Club","3.72 avg rating — 75,749 ratings","420 pages, Paperback",186,English,5317 people are currently reading,193053 people want to read
"The Next One Is for You: A True Story of Guns, Country, and the IRA’s Secret American Army","First published March 11, 2025",Ali Watkins,"History, Nonfiction, Ireland, True Crime, Audiobook, Politics, American History",4.09 avg rating — 432 ratings,"336 pages, Hardcover",189,,73 people are currently reading,1276 people want to read
"The Medusa Protocol (Assassins Anonymous, #2)","First published June 24, 2025",Rob Hart,"Thriller, Fiction, Mystery, Mystery Thriller, Suspense, Crime, Audiobook","4.09 avg rating — 2,206 ratings","320 pages, Kindle Edition",189,English,123 people are currently reading,9248 people want to read
Mark Twain,"First published May 13, 2025",Ron Chernow,"Biography, Nonfiction, History, Biography Memoir, Audiobook, American History, Memoir","4.19 avg rating — 6,447 ratings","1200 pages, Hardcover",191,,5205 people are currently reading,44432 people want to read
"Exit Strategy (Jack Reacher, #30)","First published November 4, 2025",Lee Child,"Thriller, Fiction, Mystery, Crime, Mystery Thriller, Audiobook, Action","3.75 avg rating — 23,166 ratings","304 pages, Hardcover",191,English,6257 people are currently reading,16974 people want to read
"Saga, Volume 12","First published April 30, 2025",Brian K. Vaughan,"Graphic Novels, Comics, Fantasy, Science Fiction, Fiction, Adult, Graphic Novels Comics","4.10 avg rating — 4,953 ratings","160 pages, Paperback",191,,113 people are currently reading,4535 people want to read
Daedalus Is Dead,"First published September 30, 2025",Seamus Sullivan,"Fantasy, Mythology, Retellings, Novella, Fiction, Adult, Audiobook",3.81 avg rating — 520 ratings,"164 pages, Hardcover",194,English,32 people are currently reading,7403 people want to read
The Autumn Springs Retirement Home Massacre,"First published September 30, 2025",Philip Fracassi,"Horror, Mystery, Thriller, Fiction, Audiobook, Mystery Thriller, Adult","4.04 avg rating — 6,028 ratings","416 pages, Hardcover",194,English,469 people are currently reading,18824 people want to read
Tough Luck,"First published April 29, 2025",Sandra Dallas,"Historical Fiction, Westerns, Fiction, Historical, Audiobook, Adventure, Coming Of Age","3.88 avg rating — 2,488 ratings","288 pages, Hardcover",196,English,261 people are currently reading,12508 people want to read
"Spiral (Off the Ice, #2)","First published January 28, 2025",Bal Khabra,"Romance, Sports Romance, Hockey, Sports, Fake Dating, Hockey Romance, Contemporary","3.81 avg rating — 51,984 ratings","367 pages, Unknown Binding",196,,2269 people are currently reading,106062 people want to read
"We Are All Guilty Here (North Falls, #1)","First published August 12, 2025",Karin Slaughter,"Thriller, Mystery, Audiobook, Mystery Thriller, Fiction, Crime, Suspense","4.21 avg rating — 134,175 ratings","439 pages, Hardcover",196,,17281 people are currently reading,226811 people want to read
"Never Flinch (Holly Gibney, #4)","First published May 27, 2025",Stephen King,"Horror, Thriller, Fiction, Mystery, Audiobook, Crime, Mystery Thriller","3.82 avg rating — 68,267 ratings","448 pages, Hardcover",196,English,11696 people are currently reading,93468 people want to read
The Seasons #2,"First published February 26, 2025",Rick Remender,Comics,4.17 avg rating — 72 ratings,"32 pages, Kindle Edition",200,,2 people are currently reading,14 people want to read
Murder at Gulls Nest (Nora Breen Investigates #1),"First published March 11, 2025",Jess Kidd,"Mystery, Historical Fiction, Fiction, Cozy Mystery, Audiobook, Mystery Thriller, Cozy","3.75 avg rating — 9,512 ratings","336 pages, Kindle Edition",201,,846 people are currently reading,37782 people want to read
After Life,"First published January 7, 2025",Gayle Forman,"Young Adult, Fiction, Contemporary, Fantasy, Audiobook, Death, Family","3.61 avg rating — 5,581 ratings","272 pages, Hardcover",202,,548 people are currently reading,15768 people want to read
Book of Cutter #1,"First published January 29, 2025",James Tynion IV,"Horror, Comics, Graphic Novels, Fantasy, Graphic Novels Comics",3.86 avg rating — 194 ratings,"96 pages, Kindle Edition",202,English,14 people are currently reading,104 people want to read
Count My Lies,"First published March 4, 2025",Sophie Stava,"Thriller, Mystery, Audiobook, Mystery Thriller, Fiction, Book Club, Suspense","3.72 avg rating — 83,449 ratings","336 pages, Hardcover",202,English,4436 people are currently reading,164565 people want to read
King of Ashes,"First published June 10, 2025",S.A. Cosby,"Thriller, Fiction, Mystery, Audiobook, Mystery Thriller, Crime, Suspense","3.99 avg rating — 66,487 ratings","333 pages, Hardcover",202,English,7040 people are currently reading,143572 people want to read
Last Twilight in Paris,"First published February 4, 2025",Pam Jenoff,"Historical Fiction, Fiction, Mystery, World War II, Audiobook, Historical, Romance","3.96 avg rating — 28,817 ratings","336 pages, Hardcover",202,English,4278 people are currently reading,86210 people want to read
"Maggie; or, A Man and a Woman Walk Into a Bar","First published July 22, 2025",Katie Yee,"Fiction, Contemporary, Audiobook, Literary Fiction, Humor, Adult Fiction, Adult","3.35 avg rating — 15,496 ratings","200 pages, Hardcover",207,English,1177 people are currently reading,47787 people want to read
Far and Away,"First published June 10, 2025",Amy Poeppel,"Fiction, Audiobook, Romance, Contemporary, Chick Lit, Travel, Humor","3.97 avg rating — 7,958 ratings","388 pages, Paperback",208,,810 people are currently reading,24186 people want to read
Other People’s Fun,"First published November 4, 2025",Harriet Lane,"Fiction, Contemporary, Literary Fiction, Social Media, Audiobook, Adult Fiction, Thriller",3.17 avg rating — 608 ratings,"208 pages, Kindle Edition",209,,212 people are currently reading,5756 people want to read
"The Enchanted Greenhouse (Spellshop, #2)","First published July 15, 2025",Sarah Beth Durst,"Fantasy, Romance, Cozy, Cozy Fantasy, Audiobook, Fiction, Romantasy","4.12 avg rating — 41,911 ratings","374 pages, Hardcover",209,,3730 people are currently reading,85052 people want to read
A Granite Silence,"First published April 10, 2025",Nina Allan,"Historical Fiction, Fiction, Historical, Mystery, Crime",4.11 avg rating — 62 ratings,"352 pages, Kindle Edition",211,English,7 people are currently reading,291 people want to read
The Three Lives of Cate Kay,"First published January 7, 2025",Kate Fagan,"Fiction, Audiobook, LGBT, Contemporary, Book Club, Romance, Mystery","3.74 avg rating — 100,315 ratings","294 pages, Hardcover",211,English,10350 people are currently reading,145487 people want to read
"Head Cases (Head Cases, #1)","First published January 28, 2025",John McMahon,"Mystery, Thriller, Mystery Thriller, Fiction, Audiobook, Crime, Suspense","really liked it
4.00 avg rating — 14,190 ratings","341 pages, Hardcover",211,English,973 people are currently reading,65335 people want to read
Let the Bad Times Roll,"First published July 10, 2025",Alice Slater,"Thriller, Mystery, Fiction, Mystery Thriller, Contemporary, British Literature, Adult Fiction",3.70 avg rating — 824 ratings,"336 pages, Kindle Edition",214,English,57 people are currently reading,1911 people want to read
Victorian Psycho,"First published January 9, 2025",Virginia Feito,"Horror, Historical Fiction, Fiction, Gothic, Audiobook, Historical, Thriller","3.54 avg rating — 44,516 ratings","208 pages, Hardcover",214,,2284 people are currently reading,85758 people want to read
A Killing Cold,"First published February 4, 2025",Kate Alice Marshall,"Thriller, Mystery, Mystery Thriller, Audiobook, Fiction, Suspense, Adult","3.76 avg rating — 65,276 ratings","291 pages, Hardcover",216,English,3124 people are currently reading,119100 people want to read
Isola,"First published February 4, 2025",Allegra Goodman,"Historical Fiction, Fiction, Audiobook, Book Club, Historical, Literary Fiction, France","really liked it
4.00 avg rating — 98,083 ratings","346 pages, Hardcover",217,English,11401 people are currently reading,192676 people want to read
"The Beasts We Bury (The Broken Citadel, #1)","First published February 4, 2025",D.L. Taylor,"Fantasy, Romance, Young Adult, Romantasy, Audiobook, Fiction, Magic","3.72 avg rating — 1,948 ratings","368 pages, Hardcover",217,English,183 people are currently reading,55006 people want to read
When the Tides Held the Moon,"First published April 29, 2025",Venessa Vida Kelley,"Fantasy, Romance, Historical Fiction, LGBT, Queer, Historical, Romantasy","4.17 avg rating — 10,943 ratings","464 pages, Hardcover",219,English,1566 people are currently reading,90885 people want to read
This Book Will Bury Me,"First published March 25, 2025",Ashley Winstead,"Thriller, Mystery, Mystery Thriller, Fiction, Audiobook, Crime, Adult","3.63 avg rating — 27,623 ratings","480 pages, Hardcover",220,English,2081 people are currently reading,113214 people want to read
All the Other Mothers Hate Me,"First published March 11, 2025",Sarah Harman,"Mystery, Fiction, Audiobook, Thriller, Mystery Thriller, Book Club, Adult","3.50 avg rating — 35,589 ratings","384 pages, Hardcover",220,English,2396 people are currently reading,74483 people want to read
"Death Row (Alibis Collection, #1)","First published June 1, 2025",Freida McFadden,"Thriller, Mystery, Short Stories, Fiction, Mystery Thriller, Audiobook, Novella","3.53 avg rating — 220,230 ratings","74 pages, Kindle Edition",222,English,34949 people are currently reading,120995 people want to read
A Sea of Unspoken Things,"First published January 7, 2025",Adrienne Young,"Mystery, Fantasy, Fiction, Magical Realism, Mystery Thriller, Thriller, Audiobook","3.67 avg rating — 27,715 ratings","288 pages, Hardcover",223,English,1164 people are currently reading,117032 people want to read
"Fight (Sky Ridge Hotshots, #1)",,Sloane St. James,,"3.81 avg rating — 42,172 ratings",,223,,,
The Sirens,"First published February 13, 2025",Emilia Hart,"Fantasy, Historical Fiction, Fiction, Magical Realism, Audiobook, Mystery, Historical","3.72 avg rating — 59,497 ratings","337 pages, Hardcover",225,English,5796 people are currently reading,175877 people want to read
"Careless People: A Cautionary Tale of Power, Greed, and Lost Idealism","First published March 11, 2025",Sarah Wynn-Williams,"Nonfiction, Memoir, Audiobook, Business, Politics, Biography, Technology","4.13 avg rating — 111,708 ratings","382 pages, Hardcover",226,,20445 people are currently reading,173046 people want to read
"The Devils (The Devils, #1)","First published May 6, 2025",Joe Abercrombie,"Fantasy, Horror, Fiction, Audiobook, Dark Fantasy, Historical Fiction, Adult","4.22 avg rating — 63,282 ratings","565 pages, Hardcover",227,,14528 people are currently reading,187210 people want to read
A Harvest of Hearts,"First published March 4, 2025",Andrea Eames,"Fantasy, Romance, Romantasy, Magic, Fiction, Audiobook, Young Adult","3.59 avg rating — 8,063 ratings","437 pages, Hardcover",227,English,1406 people are currently reading,74224 people want to read
"Alchemy of Secrets (Alchemy of Secrets, #1)","First published October 7, 2025",Stephanie Garber,"Fantasy, Romance, Romantasy, Fiction, Mystery, Adult, Dark Academia","3.86 avg rating — 56,382 ratings","324 pages, Hardcover",229,,3916 people are currently reading,188899 people want to read
Aftertaste,"First published May 20, 2025",Daria Lavelle,"Fantasy, Fiction, Magical Realism, Audiobook, Romance, Paranormal, Horror","3.89 avg rating — 17,591 ratings","400 pages, Hardcover",230,,1802 people are currently reading,83455 people want to read
"The Woman in Suite 11 (Lo Blacklock, #2)","First published July 8, 2025",Ruth Ware,"Mystery, Thriller, Audiobook, Mystery Thriller, Fiction, Suspense, Crime","3.55 avg rating — 63,326 ratings","387 pages, Hardcover",231,,6944 people are currently reading,98794 people want to read
Black Woods Blue Sky,"First published February 4, 2025",Eowyn Ivey,"Fantasy, Fiction, Magical Realism, Romance, Literary Fiction, Audiobook, Retellings","3.72 avg rating — 22,189 ratings","306 pages, Hardcover",232,,1398 people are currently reading,73202 people want to read
Wild Reverence,"First published September 2, 2025",Rebecca Ross,"Fantasy, Romantasy, Romance, Audiobook, Fiction, Fantasy Romance, Young Adult","4.32 avg rating — 53,883 ratings","527 pages, Hardcover",232,,11915 people are currently reading,237961 people want to read
You Are Fatally Invited,"First published February 11, 2025",Ande Pliego,"Mystery, Thriller, Mystery Thriller, Fiction, Audiobook, Adult, Suspense","3.56 avg rating — 18,833 ratings","371 pages, Hardcover",234,English,1328 people are currently reading,100451 people want to read
The Bewitching,"First published July 15, 2025",Silvia Moreno-Garcia,"Horror, Fantasy, Historical Fiction, Fiction, Gothic, Witches, Audiobook","3.81 avg rating — 40,353 ratings","357 pages, Hardcover",234,,3646 people are currently reading,162791 people want to read
It's a Love Story,"First published May 27, 2025",Annabel Monaghan,"Romance, Audiobook, Fiction, Summer, Contemporary, Contemporary Romance, Summer Reads","3.85 avg rating — 85,490 ratings","368 pages, Paperback",236,,4908 people are currently reading,136328 people want to read
Stag Dance,"First published March 11, 2025",Torrey Peters,"Short Stories, Fiction, Queer, LGBT, Horror, Contemporary, Literary Fiction","3.86 avg rating — 10,299 ratings","288 pages, Hardcover",236,English,1244 people are currently reading,43349 people want to read
"Glorious Rivals (The Grandest Game, #2)","First published July 29, 2025",Jennifer Lynn Barnes,"Mystery, Young Adult, Romance, Fiction, Mystery Thriller, Thriller, Audiobook","4.07 avg rating — 27,636 ratings","432 pages, Hardcover",236,English,2749 people are currently reading,56709 people want to read
Nine-Tenths,"First published June 30, 2025",J.M. Frey,"Fantasy, Dragons, Romance, M M Romance, Paranormal, Contemporary, LGBT",4.29 avg rating — 178 ratings,"470 pages, ebook",236,,24 people are currently reading,584 people want to read
A Girl Within a Girl Within a Girl,"First published March 4, 2025",Nanda Reddy,"Fiction, Historical Fiction, Audiobook, Literary Fiction, Contemporary, Book Club, Family","4.28 avg rating — 1,714 ratings","384 pages, Paperback",236,English,178 people are currently reading,21963 people want to read
Lessons in Magic and Disaster,"First published August 19, 2025",Charlie Jane Anders,"Fantasy, Fiction, Queer, Witches, LGBT, Dark Academia, Magic",3.67 avg rating — 993 ratings,"320 pages, Hardcover",236,English,225 people are currently reading,15746 people want to read
Fake Skating,"First published September 30, 2025",Lynn Painter,"Romance, Young Adult, Sports Romance, Fake Dating, Sports, Contemporary, Friends To Lovers","4.25 avg rating — 82,168 ratings","448 pages, Hardcover",236,English,6138 people are currently reading,132520 people want to read
Coffin Moon,"First published September 9, 2025",Keith Rosson,"Horror, Vampires, Fiction, Historical Fiction, Thriller, Audiobook, Historical","4.10 avg rating — 8,773 ratings","320 pages, Hardcover",236,English,1003 people are currently reading,44259 people want to read
"Born Equal: Remaking America’s Constitution, 1840–1920","First published September 16, 2025",Akhil Reed Amar,"History, Nonfiction, American History, Law, Politics, History and Politics",4.33 avg rating — 79 ratings,"736 pages, Hardcover",236,English,74 people are currently reading,704 people want to read
"Tears of the Wolf (Wrath and Weeping, #1)","First published February 21, 2025",Elisabeth Wheatley,"Fantasy, Romance, Romantasy, Fantasy Romance, Fiction, Historical, Magic","4.29 avg rating — 4,050 ratings","316 pages, ebook",236,English,331 people are currently reading,8401 people want to read
The Corruption of Hollis Brown,"First published April 22, 2025",K. Ancrum,"Horror, Young Adult, Romance, Fantasy, LGBT, Queer, Paranormal","4.23 avg rating — 2,276 ratings","380 pages, Hardcover",236,English,117 people are currently reading,12509 people want to read
Bog Queen,"First published October 14, 2025",Anna North,"Historical Fiction, Fiction, Mystery, Historical, Horror, Audiobook, Mystery Thriller","3.61 avg rating — 5,616 ratings","288 pages, Hardcover",236,English,773 people are currently reading,29807 people want to read
The Everlasting,"First published October 28, 2025",Alix E. Harrow,"Fantasy, Romance, Romantasy, Fiction, Time Travel, Audiobook, Historical Fiction","4.25 avg rating — 39,739 ratings","320 pages, Hardcover",236,English,7922 people are currently reading,187868 people want to read
Are You Mad at Me?,"First published August 5, 2025",Meg Josephson,"Nonfiction, Self Help, Psychology, Audiobook, Mental Health, Personal Development, Relationships","4.39 avg rating — 9,368 ratings","304 pages, Kindle Edition",236,English,4283 people are currently reading,72972 people want to read
"Separation of Church and Hate: A Sane Person's Guide to Taking Back the Bible from Fundamentalists, Fascists, and Flock-Fleecing Frauds","First published September 9, 2025",John Fugelsang,"Nonfiction, Religion, Politics, Audiobook, History, Humor, Faith","4.45 avg rating — 10,195 ratings","288 pages, Hardcover",236,,5169 people are currently reading,30081 people want to read
Vaim,"First published September 5, 2025",Jon Fosse,"Fiction, Literature, Audiobook, Literary Fiction, Novella, Scandinavian Literature, Novels","4.01 avg rating — 1,859 ratings","120 pages, Hardcover",236,,139 people are currently reading,2998 people want to read
The Loneliness of Sonia and Sunny,"First published September 23, 2025",Kiran Desai,"Fiction, India, Literary Fiction, Historical Fiction, Romance, Audiobook, Book Club","3.78 avg rating — 23,693 ratings","670 pages, Hardcover",236,,16368 people are currently reading,103572 people want to read
Mad Mabel,"First published October 1, 2025",Sally Hepworth,"Mystery, Thriller, Fiction, Audiobook, Mystery Thriller, Book Club, Crime","4.39 avg rating — 27,810 ratings","352 pages, Hardcover",236,English,3428 people are currently reading,65346 people want to read
"The Marriage Method (The Crinoline Academy, #2)","First published November 25, 2025",Mimi Matthews,"Romance, Historical Romance, Historical Fiction, Mystery, Historical, Fiction, Marriage Of Convenience","4.18 avg rating — 2,528 ratings","380 pages, Paperback",236,English,171 people are currently reading,19979 people want to read
Who Is Government? The Untold Story of Public Service,"First published March 18, 2025",Michael Lewis,"Nonfiction, Politics, History, Audiobook, Essays, Government, Biography","4.18 avg rating — 14,523 ratings","272 pages, Hardcover",255,,2895 people are currently reading,27719 people want to read
The Incandescent,"First published May 13, 2025",Emily Tesh,"Fantasy, Dark Academia, Queer, LGBT, Fiction, Lesbian, Audiobook","3.95 avg rating — 10,913 ratings","432 pages, Kindle Edition",255,English,927 people are currently reading,62463 people want to read
Food Person,"First published May 20, 2025",Adam D. Roberts,"Fiction, Food, Contemporary, Humor, Adult, Adult Fiction, Cookbooks","3.63 avg rating — 3,813 ratings","320 pages, Hardcover",255,English,221 people are currently reading,21461 people want to read
107 Days,"First published September 23, 2025",Kamala Harris,"Nonfiction, Audiobook, Memoir, Politics, History, Biography, Biography Memoir","4.29 avg rating — 55,313 ratings","320 pages, Kindle Edition",255,,11975 people are currently reading,54480 people want to read
"Slayers, Every One of Us: How One Girl in All the World Showed Us How to Hold On","First published April 8, 2025",Kristin Russo,"Nonfiction, Audiobook, Memoir, LGBT, Queer, Vampires, Pop Culture","4.08 avg rating — 1,373 ratings","256 pages, Hardcover",255,,68 people are currently reading,12894 people want to read
TERF Island: How the UK Resisted Trans Ideology,"First published July 1, 2025",Fiona McAnena,"Nonfiction, Politics, Gender, Feminism",3.84 avg rating — 44 ratings,"300 pages, Paperback",255,English,11 people are currently reading,178 people want to read
Last Rites,"First published October 7, 2025",Ozzy Osbourne,"Nonfiction, Music, Biography, Memoir, Audiobook, Autobiography, Biography Memoir","4.46 avg rating — 6,973 ratings","368 pages, Hardcover",255,,1242 people are currently reading,9207 people want to read
Cannon,"First published September 9, 2025",Lee Lai,"Graphic Novels, Comics, Fiction, Queer, LGBT, Friendship, Graphic Novels Comics",4.43 avg rating — 768 ratings,"304 pages, Hardcover",255,English,25 people are currently reading,1879 people want to read
"Tourist Season (The Seasons of Carnage Trilogy, #1)","First published September 23, 2025",Brynne Weaver,"Romance, Dark Romance, Audiobook, Enemies To Lovers, Thriller, Dark, Contemporary","4.16 avg rating — 81,861 ratings","400 pages, Hardcover",255,,6526 people are currently reading,142253 people want to read
"Rules for Ruin (The Crinoline Academy, #1)","First published May 20, 2025",Mimi Matthews,"Romance, Historical Fiction, Historical Romance, Historical, Fiction, Fantasy, Audiobook","3.97 avg rating — 5,510 ratings","400 pages, Paperback",255,English,556 people are currently reading,28516 people want to read
The Cartoonists Club,"First published April 1, 2025",Raina Telgemeier,"Graphic Novels, Middle Grade, Comics, Fiction, Childrens, Art, Realistic Fiction","3.66 avg rating — 6,862 ratings","280 pages, Paperback",265,English,412 people are currently reading,8691 people want to read
The Works of Vermin,"First published October 14, 2025",Hiron Ennes,"Fantasy, Horror, Fiction, Queer, LGBT, Adult, Science Fiction","4.26 avg rating — 1,208 ratings","425 pages, Hardcover",265,English,288 people are currently reading,14414 people want to read
Full Bloom,"First published August 5, 2025",Francesca Serritella,"Fiction, Mystery, Magical Realism, Contemporary, Romance, Audiobook, Literary Fiction","3.70 avg rating — 1,599 ratings","416 pages, Hardcover",265,English,124 people are currently reading,19606 people want to read
The Loneliness of Sonia and Sunny,"First published September 23, 2025",Kiran Desai,"Fiction, India, Literary Fiction, Historical Fiction, Romance, Audiobook, Book Club","3.78 avg rating — 23,693 ratings","671 pages, Paperback",265,,16368 people are currently reading,103572 people want to read
"Red Tempest Brother (The Winter Sea, #3)","First published July 8, 2025",H.M. Long,"Fantasy, Pirates, Audiobook, Adult, Romance, Science Fiction Fantasy, Fantasy Romance",3.97 avg rating — 534 ratings,"409 pages, Paperback",265,English,60 people are currently reading,1899 people want to read
"Marble Hall Murders (Susan Ryeland, #3)","First published May 13, 2025",Anthony Horowitz,"Mystery, Fiction, Audiobook, Crime, Mystery Thriller, Thriller, British Literature","4.26 avg rating — 29,235 ratings","579 pages, Kindle Edition",265,English,3169 people are currently reading,29505 people want to read
Night Watcher,"First published July 8, 2025",Daphne Woolsoncroft,"Thriller, Horror, Mystery, Mystery Thriller, Audiobook, Fiction, Adult","3.71 avg rating — 11,604 ratings","336 pages, Hardcover",265,English,826 people are currently reading,41456 people want to read
